<?xml version="1.0" standalone="no"?>
<!DOCTYPE HistogramConfigurations [
<!ELEMENT HistogramConfigurations (HistogramConfiguration)+>
<!ELEMENT HistogramConfiguration (Histogram)+>
<!ATTLIST HistogramConfiguration
model CDATA #REQUIRED
>
<!ELEMENT Histogram EMPTY>
<!ATTLIST Histogram
schema CDATA #REQUIRED
id CDATA #REQUIRED
>
]>
<HistogramConfigurations>
    <HistogramConfiguration model="200CII" >
        <Histogram schema="VIMS" id="1" />
        <Histogram schema="VIMS" id="7" />
        <Histogram schema="VIMS" id="11" />
        <Histogram schema="VIMS" id="17" />
        <Histogram schema="VIMS" id="29" />
        <Histogram schema="VIMS" id="52" />
        <Histogram schema="VIMS" id="53" />
        <Histogram schema="VIMS" id="70" />
        <Histogram schema="VIMS" id="71" />
        <Histogram schema="VIMS" id="72" />
        <Histogram schema="VIMS" id="73" />
        <Histogram schema="VIMS" id="74" />
        <Histogram schema="VIMS" id="75" />
        <Histogram schema="VIMS" id="76" />
    </HistogramConfiguration>
    <HistogramConfiguration model="330C" >
        <Histogram schema="VIMS" id="900" />
        <Histogram schema="VIMS" id="901" />
        <Histogram schema="VIMS" id="130" />
        <Histogram schema="VIMS" id="902" />
        <Histogram schema="VIMS" id="903" />
        <Histogram schema="VIMS" id="904" />
        <Histogram schema="VIMS" id="905" />
        <Histogram schema="VIMS" id="906" />
    </HistogramConfiguration>
    <HistogramConfiguration model="5130" >
        <Histogram schema="VIMS" id="1" />
        <Histogram schema="VIMS" id="16" />
        <Histogram schema="VIMS" id="22" />
        <Histogram schema="VIMS" id="44" />
    </HistogramConfiguration>
    <HistogramConfiguration model="5130B" >
        <Histogram schema="VIMS" id="1" />
        <Histogram schema="VIMS" id="16" />
        <Histogram schema="VIMS" id="22" />
        <Histogram schema="VIMS" id="44" />
        <Histogram schema="VIMS" id="60" />
    </HistogramConfiguration>
    <HistogramConfiguration model="5130C" >
        <Histogram schema="VIMS" id="115" />
        <Histogram schema="VIMS" id="85" />
        <Histogram schema="VIMS" id="13" />
        <Histogram schema="VIMS" id="161" />
        <Histogram schema="VIMS" id="166" />
        <Histogram schema="VIMS" id="173" />
        <Histogram schema="VIMS" id="164" />
        <Histogram schema="VIMS" id="124" />
        <Histogram schema="VIMS" id="125" />
        <Histogram schema="VIMS" id="165" />
        <Histogram schema="VIMS" id="167" />
        <Histogram schema="VIMS" id="22" />
        <Histogram schema="VIMS" id="44" />
        <Histogram schema="VIMS" id="60" />
        <Histogram schema="VIMS" id="172" />
        <Histogram schema="VIMS" id="163" />
    </HistogramConfiguration>
    <HistogramConfiguration model="5230" >
        <Histogram schema="VIMS" id="1" />
        <Histogram schema="VIMS" id="16" />
        <Histogram schema="VIMS" id="22" />
        <Histogram schema="VIMS" id="44" />
        <Histogram schema="VIMS" id="60" />
    </HistogramConfiguration>
    <HistogramConfiguration model="5230B" >
        <Histogram schema="VIMS" id="165" />
        <Histogram schema="VIMS" id="127" />
        <Histogram schema="VIMS" id="22" />
        <Histogram schema="VIMS" id="44" />
        <Histogram schema="VIMS" id="60" />
        <Histogram schema="VIMS" id="124" />
        <Histogram schema="VIMS" id="125" />
        <Histogram schema="VIMS" id="115" />
        <Histogram schema="VIMS" id="85" />
        <Histogram schema="VIMS" id="13" />
        <Histogram schema="VIMS" id="161" />
        <Histogram schema="VIMS" id="162" />
        <Histogram schema="VIMS" id="163" />
        <Histogram schema="VIMS" id="164" />
        <Histogram schema="VIMS" id="166" />
        <Histogram schema="VIMS" id="167" />
    </HistogramConfiguration>
    <HistogramConfiguration model="583T" >
        <Histogram schema="VIMS" id="24" />
        <Histogram schema="VIMS" id="752" />
        <Histogram schema="VIMS" id="758" />
        <Histogram schema="VIMS" id="757" />
        <Histogram schema="VIMS" id="755" />
        <Histogram schema="VIMS" id="764" />
        <Histogram schema="VIMS" id="750" />
        <Histogram schema="VIMS" id="777" />
        <Histogram schema="VIMS" id="775" />
        <Histogram schema="VIMS" id="782" />
        <Histogram schema="VIMS" id="776" />
        <Histogram schema="VIMS" id="783" />
        <Histogram schema="VIMS" id="784" />
        <Histogram schema="VIMS" id="785" />
    </HistogramConfiguration>
    <HistogramConfiguration model="587T" >
        <Histogram schema="VIMS" id="24" />
        <Histogram schema="VIMS" id="752" />
        <Histogram schema="VIMS" id="758" />
        <Histogram schema="VIMS" id="757" />
        <Histogram schema="VIMS" id="761" />
        <Histogram schema="VIMS" id="750" />
        <Histogram schema="VIMS" id="764" />
        <Histogram schema="VIMS" id="751" />
        <Histogram schema="VIMS" id="781" />
        <Histogram schema="VIMS" id="789" />
        <Histogram schema="VIMS" id="790" />
        <Histogram schema="VIMS" id="791" />
        <Histogram schema="VIMS" id="775" />
        <Histogram schema="VIMS" id="782" />
        <Histogram schema="VIMS" id="776" />
        <Histogram schema="VIMS" id="783" />
        <Histogram schema="VIMS" id="784" />
        <Histogram schema="VIMS" id="785" />
    </HistogramConfiguration>
    <HistogramConfiguration model="773F" >
        <Histogram schema="VIMS" id="1" />
        <Histogram schema="VIMS" id="17" />
        <Histogram schema="VIMS" id="52" />
        <Histogram schema="VIMS" id="85" />
        <Histogram schema="VIMS" id="124" />
        <Histogram schema="VIMS" id="125" />
        <Histogram schema="VIMS" id="153" />
        <Histogram schema="VIMS" id="154" />
        <Histogram schema="VIMS" id="155" />
        <Histogram schema="VIMS" id="156" />
        <Histogram schema="VIMS" id="174" />
        <Histogram schema="VIMS" id="175" />
    </HistogramConfiguration>
    <HistogramConfiguration model="773G" >
        <Histogram schema="VIMS" id="1" />
        <Histogram schema="VIMS" id="85" />
        <Histogram schema="VIMS" id="17" />
        <Histogram schema="VIMS" id="52" />
        <Histogram schema="VIMS" id="174" />
        <Histogram schema="VIMS" id="175" />
        <Histogram schema="VIMS" id="153" />
        <Histogram schema="VIMS" id="154" />
        <Histogram schema="VIMS" id="155" />
        <Histogram schema="VIMS" id="156" />
        <Histogram schema="VIMS" id="97" />
        <Histogram schema="VIMS" id="104" />
        <Histogram schema="VIMS" id="98" />
        <Histogram schema="VIMS" id="105" />
        <Histogram schema="VIMS" id="96" />
        <Histogram schema="VIMS" id="179" />
        <Histogram schema="VIMS" id="180" />
        <Histogram schema="VIMS" id="181" />
        <Histogram schema="VIMS" id="182" />
        <Histogram schema="VIMS" id="183" />
        <Histogram schema="VIMS" id="184" />
        <Histogram schema="VIMS" id="60" />
    </HistogramConfiguration>
    <HistogramConfiguration model="773G LRC" >
        <Histogram schema="VIMS" id="1" />
        <Histogram schema="VIMS" id="85" />
        <Histogram schema="VIMS" id="17" />
        <Histogram schema="VIMS" id="52" />
        <Histogram schema="VIMS" id="174" />
        <Histogram schema="VIMS" id="175" />
        <Histogram schema="VIMS" id="153" />
        <Histogram schema="VIMS" id="154" />
        <Histogram schema="VIMS" id="155" />
        <Histogram schema="VIMS" id="156" />
        <Histogram schema="VIMS" id="97" />
        <Histogram schema="VIMS" id="104" />
        <Histogram schema="VIMS" id="98" />
        <Histogram schema="VIMS" id="105" />
        <Histogram schema="VIMS" id="96" />
        <Histogram schema="VIMS" id="179" />
        <Histogram schema="VIMS" id="180" />
        <Histogram schema="VIMS" id="181" />
        <Histogram schema="VIMS" id="182" />
        <Histogram schema="VIMS" id="183" />
        <Histogram schema="VIMS" id="184" />
        <Histogram schema="VIMS" id="60" />
    </HistogramConfiguration>
    <HistogramConfiguration model="775F" >
        <Histogram schema="VIMS" id="1" />
        <Histogram schema="VIMS" id="17" />
        <Histogram schema="VIMS" id="52" />
        <Histogram schema="VIMS" id="85" />
        <Histogram schema="VIMS" id="124" />
        <Histogram schema="VIMS" id="125" />
        <Histogram schema="VIMS" id="153" />
        <Histogram schema="VIMS" id="154" />
        <Histogram schema="VIMS" id="155" />
        <Histogram schema="VIMS" id="156" />
        <Histogram schema="VIMS" id="174" />
        <Histogram schema="VIMS" id="175" />
    </HistogramConfiguration>
    <HistogramConfiguration model="775G" >
        <Histogram schema="VIMS" id="1" />
        <Histogram schema="VIMS" id="85" />
        <Histogram schema="VIMS" id="17" />
        <Histogram schema="VIMS" id="52" />
        <Histogram schema="VIMS" id="174" />
        <Histogram schema="VIMS" id="175" />
        <Histogram schema="VIMS" id="153" />
        <Histogram schema="VIMS" id="154" />
        <Histogram schema="VIMS" id="155" />
        <Histogram schema="VIMS" id="156" />
        <Histogram schema="VIMS" id="97" />
        <Histogram schema="VIMS" id="104" />
        <Histogram schema="VIMS" id="98" />
        <Histogram schema="VIMS" id="105" />
        <Histogram schema="VIMS" id="96" />
        <Histogram schema="VIMS" id="179" />
        <Histogram schema="VIMS" id="180" />
        <Histogram schema="VIMS" id="181" />
        <Histogram schema="VIMS" id="182" />
        <Histogram schema="VIMS" id="183" />
        <Histogram schema="VIMS" id="184" />
        <Histogram schema="VIMS" id="60" />
    </HistogramConfiguration>
    <HistogramConfiguration model="775G LRC" >
        <Histogram schema="VIMS" id="1" />
        <Histogram schema="VIMS" id="85" />
        <Histogram schema="VIMS" id="17" />
        <Histogram schema="VIMS" id="52" />
        <Histogram schema="VIMS" id="174" />
        <Histogram schema="VIMS" id="175" />
        <Histogram schema="VIMS" id="153" />
        <Histogram schema="VIMS" id="154" />
        <Histogram schema="VIMS" id="155" />
        <Histogram schema="VIMS" id="156" />
        <Histogram schema="VIMS" id="338" />
        <Histogram schema="VIMS" id="339" />
        <Histogram schema="VIMS" id="340" />
        <Histogram schema="VIMS" id="341" />
        <Histogram schema="VIMS" id="60" />
    </HistogramConfiguration>
    <HistogramConfiguration model="776D" >
        <Histogram schema="VIMS" id="1" />
        <Histogram schema="VIMS" id="17" />
        <Histogram schema="VIMS" id="52" />
        <Histogram schema="VIMS" id="60" />
        <Histogram schema="VIMS" id="85" />
        <Histogram schema="VIMS" id="124" />
        <Histogram schema="VIMS" id="125" />
        <Histogram schema="VIMS" id="153" />
        <Histogram schema="VIMS" id="154" />
        <Histogram schema="VIMS" id="155" />
        <Histogram schema="VIMS" id="156" />
        <Histogram schema="VIMS" id="174" />
        <Histogram schema="VIMS" id="175" />
    </HistogramConfiguration>
    <HistogramConfiguration model="777D" >
        <Histogram schema="VIMS" id="85" />
        <Histogram schema="VIMS" id="124" />
        <Histogram schema="VIMS" id="1" />
        <Histogram schema="VIMS" id="17" />
        <Histogram schema="VIMS" id="52" />
        <Histogram schema="VIMS" id="53" />
        <Histogram schema="VIMS" id="30" />
        <Histogram schema="VIMS" id="31" />
        <Histogram schema="VIMS" id="32" />
        <Histogram schema="VIMS" id="33" />
        <Histogram schema="VIMS" id="34" />
        <Histogram schema="VIMS" id="35" />
        <Histogram schema="VIMS" id="36" />
        <Histogram schema="VIMS" id="29" />
        <Histogram schema="VIMS" id="125" />
        <Histogram schema="VIMS" id="153" />
        <Histogram schema="VIMS" id="154" />
        <Histogram schema="VIMS" id="155" />
        <Histogram schema="VIMS" id="156" />
        <Histogram schema="VIMS" id="174" />
        <Histogram schema="VIMS" id="175" />
        <Histogram schema="VIMS" id="60" />
    </HistogramConfiguration>
    <HistogramConfiguration model="777F" >
        <Histogram schema="VIMS" id="96" />
        <Histogram schema="VIMS" id="179" />
        <Histogram schema="VIMS" id="180" />
        <Histogram schema="VIMS" id="181" />
        <Histogram schema="VIMS" id="182" />
        <Histogram schema="VIMS" id="183" />
        <Histogram schema="VIMS" id="184" />
        <Histogram schema="VIMS" id="97" />
        <Histogram schema="VIMS" id="98" />
        <Histogram schema="VIMS" id="104" />
        <Histogram schema="VIMS" id="105" />
        <Histogram schema="VIMS" id="60" />
        <Histogram schema="VIMS" id="29" />
        <Histogram schema="VIMS" id="1" />
        <Histogram schema="VIMS" id="17" />
        <Histogram schema="VIMS" id="52" />
        <Histogram schema="VIMS" id="85" />
        <Histogram schema="VIMS" id="124" />
        <Histogram schema="VIMS" id="125" />
        <Histogram schema="VIMS" id="153" />
        <Histogram schema="VIMS" id="154" />
        <Histogram schema="VIMS" id="155" />
        <Histogram schema="VIMS" id="156" />
        <Histogram schema="VIMS" id="174" />
        <Histogram schema="VIMS" id="175" />
    </HistogramConfiguration>
    <HistogramConfiguration model="777G" >
        <Histogram schema="VIMS" id="1" />
        <Histogram schema="VIMS" id="85" />
        <Histogram schema="VIMS" id="17" />
        <Histogram schema="VIMS" id="52" />
        <Histogram schema="VIMS" id="174" />
        <Histogram schema="VIMS" id="175" />
        <Histogram schema="VIMS" id="153" />
        <Histogram schema="VIMS" id="154" />
        <Histogram schema="VIMS" id="155" />
        <Histogram schema="VIMS" id="156" />
        <Histogram schema="VIMS" id="97" />
        <Histogram schema="VIMS" id="104" />
        <Histogram schema="VIMS" id="98" />
        <Histogram schema="VIMS" id="105" />
        <Histogram schema="VIMS" id="96" />
        <Histogram schema="VIMS" id="179" />
        <Histogram schema="VIMS" id="180" />
        <Histogram schema="VIMS" id="181" />
        <Histogram schema="VIMS" id="182" />
        <Histogram schema="VIMS" id="183" />
        <Histogram schema="VIMS" id="184" />
        <Histogram schema="VIMS" id="60" />
        <Histogram schema="VIMS" id="109" />
    </HistogramConfiguration>
    <HistogramConfiguration model="777G_LRC" >
        <Histogram schema="VIMS" id="1" />
        <Histogram schema="VIMS" id="85" />
        <Histogram schema="VIMS" id="17" />
        <Histogram schema="VIMS" id="52" />
        <Histogram schema="VIMS" id="174" />
        <Histogram schema="VIMS" id="175" />
        <Histogram schema="VIMS" id="153" />
        <Histogram schema="VIMS" id="154" />
        <Histogram schema="VIMS" id="155" />
        <Histogram schema="VIMS" id="156" />
        <Histogram schema="VIMS" id="97" />
        <Histogram schema="VIMS" id="104" />
        <Histogram schema="VIMS" id="98" />
        <Histogram schema="VIMS" id="105" />
        <Histogram schema="VIMS" id="96" />
        <Histogram schema="VIMS" id="179" />
        <Histogram schema="VIMS" id="180" />
        <Histogram schema="VIMS" id="181" />
        <Histogram schema="VIMS" id="182" />
        <Histogram schema="VIMS" id="183" />
        <Histogram schema="VIMS" id="184" />
        <Histogram schema="VIMS" id="60" />
    </HistogramConfiguration>
    <HistogramConfiguration model="784B" >
        <Histogram schema="VIMS" id="1" />
        <Histogram schema="VIMS" id="17" />
        <Histogram schema="VIMS" id="52" />
        <Histogram schema="VIMS" id="53" />
        <Histogram schema="VIMS" id="30" />
        <Histogram schema="VIMS" id="31" />
        <Histogram schema="VIMS" id="32" />
        <Histogram schema="VIMS" id="33" />
        <Histogram schema="VIMS" id="34" />
        <Histogram schema="VIMS" id="35" />
        <Histogram schema="VIMS" id="36" />
        <Histogram schema="VIMS" id="29" />
        <Histogram schema="VIMS" id="7" />
        <Histogram schema="VIMS" id="11" />
    </HistogramConfiguration>
    <HistogramConfiguration model="784C" >
        <Histogram schema="VIMS" id="1" />
        <Histogram schema="VIMS" id="17" />
        <Histogram schema="VIMS" id="52" />
        <Histogram schema="VIMS" id="53" />
        <Histogram schema="VIMS" id="70" />
        <Histogram schema="VIMS" id="71" />
        <Histogram schema="VIMS" id="72" />
        <Histogram schema="VIMS" id="73" />
        <Histogram schema="VIMS" id="74" />
        <Histogram schema="VIMS" id="75" />
        <Histogram schema="VIMS" id="76" />
        <Histogram schema="VIMS" id="29" />
        <Histogram schema="VIMS" id="7" />
        <Histogram schema="VIMS" id="11" />
    </HistogramConfiguration>
    <HistogramConfiguration model="785B" >
        <Histogram schema="VIMS" id="1" />
        <Histogram schema="VIMS" id="17" />
        <Histogram schema="VIMS" id="51" />
        <Histogram schema="VIMS" id="53" />
        <Histogram schema="VIMS" id="30" />
        <Histogram schema="VIMS" id="31" />
        <Histogram schema="VIMS" id="32" />
        <Histogram schema="VIMS" id="33" />
        <Histogram schema="VIMS" id="34" />
        <Histogram schema="VIMS" id="35" />
        <Histogram schema="VIMS" id="36" />
        <Histogram schema="VIMS" id="29" />
        <Histogram schema="VIMS" id="7" />
        <Histogram schema="VIMS" id="11" />
    </HistogramConfiguration>
    <HistogramConfiguration model="785B0700" >
        <Histogram schema="VIMS" id="1" />
        <Histogram schema="VIMS" id="157" />
        <Histogram schema="VIMS" id="114" />
        <Histogram schema="VIMS" id="53" />
        <Histogram schema="VIMS" id="70" />
        <Histogram schema="VIMS" id="71" />
        <Histogram schema="VIMS" id="72" />
        <Histogram schema="VIMS" id="73" />
        <Histogram schema="VIMS" id="74" />
        <Histogram schema="VIMS" id="75" />
        <Histogram schema="VIMS" id="76" />
        <Histogram schema="VIMS" id="29" />
        <Histogram schema="VIMS" id="7" />
        <Histogram schema="VIMS" id="11" />
        <Histogram schema="VIMS" id="130" />
    </HistogramConfiguration>
    <HistogramConfiguration model="785C" >
        <Histogram schema="VIMS" id="1" />
        <Histogram schema="VIMS" id="17" />
        <Histogram schema="VIMS" id="52" />
        <Histogram schema="VIMS" id="53" />
        <Histogram schema="VIMS" id="70" />
        <Histogram schema="VIMS" id="71" />
        <Histogram schema="VIMS" id="72" />
        <Histogram schema="VIMS" id="73" />
        <Histogram schema="VIMS" id="74" />
        <Histogram schema="VIMS" id="75" />
        <Histogram schema="VIMS" id="76" />
        <Histogram schema="VIMS" id="29" />
        <Histogram schema="VIMS" id="7" />
        <Histogram schema="VIMS" id="11" />
        <Histogram schema="VIMS" id="153" />
        <Histogram schema="VIMS" id="154" />
        <Histogram schema="VIMS" id="155" />
        <Histogram schema="VIMS" id="156" />
        <Histogram schema="VIMS" id="100" />
        <Histogram schema="VIMS" id="169" />
        <Histogram schema="VIMS" id="124" />
        <Histogram schema="VIMS" id="125" />
        <Histogram schema="VIMS" id="85" />
        <Histogram schema="VIMS" id="108" />
        <Histogram schema="VIMS" id="60" />
        <Histogram schema="VIMS" id="161" />
        <Histogram schema="VIMS" id="174" />
        <Histogram schema="VIMS" id="175" />
    </HistogramConfiguration>
    <HistogramConfiguration model="785C0700" >
        <Histogram schema="VIMS" id="1" />
        <Histogram schema="VIMS" id="157" />
        <Histogram schema="VIMS" id="114" />
        <Histogram schema="VIMS" id="53" />
        <Histogram schema="VIMS" id="70" />
        <Histogram schema="VIMS" id="71" />
        <Histogram schema="VIMS" id="72" />
        <Histogram schema="VIMS" id="73" />
        <Histogram schema="VIMS" id="74" />
        <Histogram schema="VIMS" id="75" />
        <Histogram schema="VIMS" id="76" />
        <Histogram schema="VIMS" id="29" />
        <Histogram schema="VIMS" id="7" />
        <Histogram schema="VIMS" id="11" />
        <Histogram schema="VIMS" id="130" />
    </HistogramConfiguration>
    <HistogramConfiguration model="785D" >
        <Histogram schema="VIMS" id="1" />
        <Histogram schema="VIMS" id="7" />
        <Histogram schema="VIMS" id="11" />
        <Histogram schema="VIMS" id="17" />
        <Histogram schema="VIMS" id="29" />
        <Histogram schema="VIMS" id="52" />
        <Histogram schema="VIMS" id="53" />
        <Histogram schema="VIMS" id="60" />
        <Histogram schema="VIMS" id="70" />
        <Histogram schema="VIMS" id="71" />
        <Histogram schema="VIMS" id="72" />
        <Histogram schema="VIMS" id="73" />
        <Histogram schema="VIMS" id="74" />
        <Histogram schema="VIMS" id="75" />
        <Histogram schema="VIMS" id="76" />
        <Histogram schema="VIMS" id="85" />
        <Histogram schema="VIMS" id="100" />
        <Histogram schema="VIMS" id="108" />
        <Histogram schema="VIMS" id="124" />
        <Histogram schema="VIMS" id="125" />
        <Histogram schema="VIMS" id="153" />
        <Histogram schema="VIMS" id="154" />
        <Histogram schema="VIMS" id="155" />
        <Histogram schema="VIMS" id="156" />
        <Histogram schema="VIMS" id="161" />
        <Histogram schema="VIMS" id="169" />
        <Histogram schema="VIMS" id="174" />
        <Histogram schema="VIMS" id="175" />
        <Histogram schema="VIMS" id="114" />
        <Histogram schema="VIMS" id="130" />
        <Histogram schema="VIMS" id="157" />
    </HistogramConfiguration>
    <HistogramConfiguration model="789B" >
        <Histogram schema="VIMS" id="1" />
        <Histogram schema="VIMS" id="17" />
        <Histogram schema="VIMS" id="51" />
        <Histogram schema="VIMS" id="53" />
        <Histogram schema="VIMS" id="30" />
        <Histogram schema="VIMS" id="31" />
        <Histogram schema="VIMS" id="32" />
        <Histogram schema="VIMS" id="33" />
        <Histogram schema="VIMS" id="34" />
        <Histogram schema="VIMS" id="35" />
        <Histogram schema="VIMS" id="36" />
        <Histogram schema="VIMS" id="29" />
        <Histogram schema="VIMS" id="7" />
        <Histogram schema="VIMS" id="11" />
    </HistogramConfiguration>
    <HistogramConfiguration model="789B0700" >
        <Histogram schema="VIMS" id="1" />
        <Histogram schema="VIMS" id="157" />
        <Histogram schema="VIMS" id="114" />
        <Histogram schema="VIMS" id="53" />
        <Histogram schema="VIMS" id="70" />
        <Histogram schema="VIMS" id="71" />
        <Histogram schema="VIMS" id="72" />
        <Histogram schema="VIMS" id="73" />
        <Histogram schema="VIMS" id="74" />
        <Histogram schema="VIMS" id="75" />
        <Histogram schema="VIMS" id="76" />
        <Histogram schema="VIMS" id="29" />
        <Histogram schema="VIMS" id="7" />
        <Histogram schema="VIMS" id="11" />
        <Histogram schema="VIMS" id="130" />
        <Histogram schema="VIMS" id="153" />
        <Histogram schema="VIMS" id="154" />
        <Histogram schema="VIMS" id="155" />
        <Histogram schema="VIMS" id="156" />
    </HistogramConfiguration>
    <HistogramConfiguration model="789C" >
        <Histogram schema="VIMS" id="1" />
        <Histogram schema="VIMS" id="17" />
        <Histogram schema="VIMS" id="52" />
        <Histogram schema="VIMS" id="53" />
        <Histogram schema="VIMS" id="117" />
        <Histogram schema="VIMS" id="118" />
        <Histogram schema="VIMS" id="119" />
        <Histogram schema="VIMS" id="120" />
        <Histogram schema="VIMS" id="121" />
        <Histogram schema="VIMS" id="122" />
        <Histogram schema="VIMS" id="123" />
        <Histogram schema="VIMS" id="29" />
        <Histogram schema="VIMS" id="7" />
        <Histogram schema="VIMS" id="11" />
        <Histogram schema="VIMS" id="153" />
        <Histogram schema="VIMS" id="154" />
        <Histogram schema="VIMS" id="155" />
        <Histogram schema="VIMS" id="156" />
        <Histogram schema="VIMS" id="70" />
        <Histogram schema="VIMS" id="71" />
        <Histogram schema="VIMS" id="72" />
        <Histogram schema="VIMS" id="73" />
        <Histogram schema="VIMS" id="74" />
        <Histogram schema="VIMS" id="100" />
        <Histogram schema="VIMS" id="169" />
        <Histogram schema="VIMS" id="124" />
        <Histogram schema="VIMS" id="125" />
        <Histogram schema="VIMS" id="85" />
        <Histogram schema="VIMS" id="108" />
        <Histogram schema="VIMS" id="60" />
        <Histogram schema="VIMS" id="161" />
        <Histogram schema="VIMS" id="174" />
        <Histogram schema="VIMS" id="175" />
    </HistogramConfiguration>
    <HistogramConfiguration model="789C0700" >
        <Histogram schema="VIMS" id="1" />
        <Histogram schema="VIMS" id="157" />
        <Histogram schema="VIMS" id="114" />
        <Histogram schema="VIMS" id="53" />
        <Histogram schema="VIMS" id="70" />
        <Histogram schema="VIMS" id="71" />
        <Histogram schema="VIMS" id="72" />
        <Histogram schema="VIMS" id="73" />
        <Histogram schema="VIMS" id="74" />
        <Histogram schema="VIMS" id="75" />
        <Histogram schema="VIMS" id="76" />
        <Histogram schema="VIMS" id="29" />
        <Histogram schema="VIMS" id="7" />
        <Histogram schema="VIMS" id="11" />
        <Histogram schema="VIMS" id="130" />
        <Histogram schema="VIMS" id="153" />
        <Histogram schema="VIMS" id="154" />
        <Histogram schema="VIMS" id="155" />
        <Histogram schema="VIMS" id="156" />
    </HistogramConfiguration>
    <HistogramConfiguration model="789D" >
        <Histogram schema="VIMS" id="60" />
        <Histogram schema="VIMS" id="29" />
        <Histogram schema="VIMS" id="161" />
        <Histogram schema="VIMS" id="1" />
        <Histogram schema="VIMS" id="85" />
        <Histogram schema="VIMS" id="17" />
        <Histogram schema="VIMS" id="52" />
        <Histogram schema="VIMS" id="124" />
        <Histogram schema="VIMS" id="169" />
        <Histogram schema="VIMS" id="100" />
        <Histogram schema="VIMS" id="174" />
        <Histogram schema="VIMS" id="175" />
        <Histogram schema="VIMS" id="153" />
        <Histogram schema="VIMS" id="154" />
        <Histogram schema="VIMS" id="155" />
        <Histogram schema="VIMS" id="156" />
        <Histogram schema="VIMS" id="53" />
        <Histogram schema="VIMS" id="125" />
        <Histogram schema="VIMS" id="70" />
        <Histogram schema="VIMS" id="74" />
        <Histogram schema="VIMS" id="71" />
        <Histogram schema="VIMS" id="72" />
        <Histogram schema="VIMS" id="73" />
        <Histogram schema="VIMS" id="108" />
    </HistogramConfiguration>
    <HistogramConfiguration model="793B" >
        <Histogram schema="VIMS" id="1" />
        <Histogram schema="VIMS" id="17" />
        <Histogram schema="VIMS" id="51" />
        <Histogram schema="VIMS" id="53" />
        <Histogram schema="VIMS" id="30" />
        <Histogram schema="VIMS" id="31" />
        <Histogram schema="VIMS" id="32" />
        <Histogram schema="VIMS" id="33" />
        <Histogram schema="VIMS" id="34" />
        <Histogram schema="VIMS" id="35" />
        <Histogram schema="VIMS" id="36" />
        <Histogram schema="VIMS" id="29" />
        <Histogram schema="VIMS" id="7" />
        <Histogram schema="VIMS" id="11" />
        <Histogram schema="VIMS" id="174" />
        <Histogram schema="VIMS" id="175" />
    </HistogramConfiguration>
    <HistogramConfiguration model="793B0200" >
        <Histogram schema="VIMS" id="1" />
        <Histogram schema="VIMS" id="17" />
        <Histogram schema="VIMS" id="114" />
        <Histogram schema="VIMS" id="53" />
        <Histogram schema="VIMS" id="70" />
        <Histogram schema="VIMS" id="71" />
        <Histogram schema="VIMS" id="72" />
        <Histogram schema="VIMS" id="73" />
        <Histogram schema="VIMS" id="74" />
        <Histogram schema="VIMS" id="75" />
        <Histogram schema="VIMS" id="76" />
        <Histogram schema="VIMS" id="29" />
        <Histogram schema="VIMS" id="7" />
        <Histogram schema="VIMS" id="11" />
        <Histogram schema="VIMS" id="130" />
    </HistogramConfiguration>
    <HistogramConfiguration model="793B0700" >
        <Histogram schema="VIMS" id="1" />
        <Histogram schema="VIMS" id="157" />
        <Histogram schema="VIMS" id="114" />
        <Histogram schema="VIMS" id="53" />
        <Histogram schema="VIMS" id="70" />
        <Histogram schema="VIMS" id="71" />
        <Histogram schema="VIMS" id="72" />
        <Histogram schema="VIMS" id="73" />
        <Histogram schema="VIMS" id="74" />
        <Histogram schema="VIMS" id="75" />
        <Histogram schema="VIMS" id="76" />
        <Histogram schema="VIMS" id="29" />
        <Histogram schema="VIMS" id="7" />
        <Histogram schema="VIMS" id="11" />
        <Histogram schema="VIMS" id="130" />
        <Histogram schema="VIMS" id="153" />
        <Histogram schema="VIMS" id="154" />
        <Histogram schema="VIMS" id="155" />
        <Histogram schema="VIMS" id="156" />
    </HistogramConfiguration>
    <HistogramConfiguration model="793B0899" >
        <Histogram schema="VIMS" id="1" />
        <Histogram schema="VIMS" id="17" />
        <Histogram schema="VIMS" id="114" />
        <Histogram schema="VIMS" id="53" />
        <Histogram schema="VIMS" id="70" />
        <Histogram schema="VIMS" id="71" />
        <Histogram schema="VIMS" id="72" />
        <Histogram schema="VIMS" id="73" />